{
  "acceptance": {
    "all_passed": true,
    "gates": {
      "attribution_hit_at_3": true,
      "backlog_growth_at_least_minimum": true,
      "complete_telemetry": true,
      "content_addressed_inputs": true,
      "db_write_rate_collapses": true,
      "detection_delay_within_limit": true,
      "non_degenerate_calibration_threshold": true,
      "routine_noise_alert_rate_within_limit": true,
      "routine_noise_has_observed_effect": true,
      "structural_event_detected": true,
      "validation_alert_rate_within_limit": true,
      "worker_rate_collapses": true
    }
  },
  "attribution": {
    "expected_features": [
      "queue_depth",
      "worker_rate",
      "worker_heartbeat_age_s",
      "db_write_rate"
    ],
    "hit_at_3": true,
    "top_features": [
      "worker_heartbeat_age_s",
      "db_write_rate",
      "worker_rate"
    ]
  },
  "capture": {
    "json_message_count": 96,
    "metric_point_count": 768,
    "sha256": "a9106f93e33f7127eda2bda6de401f6733a8e656458f99c25bec5aee5d28b714"
  },
  "compiled": {
    "data_quality": {
      "flagged_points": 0,
      "missing_cells": 0,
      "reset_points": 0
    },
    "feature_count": 7,
    "feature_names": [
      "request_rate",
      "request_latency_ms",
      "error_rate",
      "queue_depth",
      "worker_rate",
      "worker_heartbeat_age_s",
      "db_write_rate"
    ],
    "feature_schema_id": "e737796d34e83d2441ac3c5681da2652e36f3f5307e92e03250ec34344008bf6",
    "window_count": 96
  },
  "detection": {
    "alert_count": 22,
    "detection_delay_windows": 0,
    "detection_latency_wall_seconds_upper_bound": 0.25,
    "first_detection_point": 64,
    "repaired_isolated_context_cells": 18,
    "routine_noise_alert_rate": 0.0,
    "routine_noise_alerts": 0,
    "routine_noise_points": 7,
    "structural_detected": true,
    "threshold": 5.460893013813363,
    "validation_alert_rate": 0.0,
    "validation_alerts": 0,
    "validation_points": 8
  },
  "detector_artifact": {
    "calibration_quantile": 0.98,
    "coefficients": [
      [
        0.20885531548890357
      ],
      [
        -0.03984291823400975
      ],
      [
        0.0
      ],
      [
        0.0
      ],
      [
        0.20885531548908848
      ],
      [
        -0.36416367317631104
      ],
      [
        0.2088553154892951
      ],
      [
        -0.006070376669651534
      ],
      [
        0.24923430220699283
      ],
      [
        0.0
      ],
      [
        0.0
      ],
      [
        -0.0060703766696374815
      ],
      [
        -0.1985655530934005
      ],
      [
        -0.006070376669624495
      ],
      [
        -0.20885531548892125
      ],
      [
        0.18560968981987586
      ],
      [
        0.0
      ],
      [
        0.0
      ],
      [
        -0.20885531548922384
      ],
      [
        0.0014618142744061296
      ],
      [
        -0.20885531548965647
      ],
      [
        0.00607037666962467
      ],
      [
        0.09543356164577337
      ],
      [
        0.0
      ],
      [
        0.0
      ],
      [
        0.006070376669631984
      ],
      [
        0.015857013891177413
      ],
      [
        0.006070376669645666
      ],
      [
        0.20885531548937974
      ],
      [
        0.13682037177681514
      ],
      [
        0.0
      ],
      [
        0.0
      ],
      [
        0.2088553154893671
      ],
      [
        0.1765950691104646
      ],
      [
        0.20885531548936698
      ],
      [
        -0.0060703766696743496
      ],
      [
        0.14857129604970226
      ],
      [
        0.0
      ],
      [
        0.0
      ],
      [
        -0.0060703766696008675
      ],
      [
        -0.2777004513988495
      ],
      [
        -0.006070376669600871
      ],
      [
        -0.051930430248595
      ]
    ],
    "components": [
      [
        -0.5235230293562145,
        -0.40579536391029114,
        2.7755575615628914e-17,
        0.0,
        -0.5235230293562144,
        0.1144597563774738,
        -0.5235230293562144
      ]
    ],
    "consensus_rank": 3,
    "context_shape": [
      6,
      7
    ],
    "kind": "coherent_latent_predictive",
    "latent_dimension": 1,
    "residual_scale": [
      0.1598464456502944,
      0.6205202863212989,
      1.0,
      1.0,
      0.1598464456502945,
      0.4576801320266138,
      0.1598464456502945
    ],
    "ridge": 0.01,
    "schema_version": 1,
    "target_center": [
      0.03967592702803501,
      0.4316947414329035,
      0.0,
      0.0,
      0.03967592702803501,
      0.19896193979412344,
      0.03967592702803501
    ],
    "threshold": 5.460893013813363
  },
  "limitations": [
    "This is one controlled local topology and one injected worker stall.",
    "Evaluator preprocessing and threshold margin were developed against this topology and schedule; this is development evidence, not an untouched confirmatory experiment.",
    "False-positive evidence covers one noise point and eight validation points, plus the six-window noise-response horizon, in a single run.",
    "Logical event-time windows are sampled faster than wall clock.",
    "The detector is fitted and tested on different intervals of one run.",
    "Feature evidence is associative attribution, not causal proof.",
    "The target encoder is linear PCA, not a learned JEPA encoder."
  ],
  "protocol": {
    "application_build_context_sha256": "5934a0342f4f1d75a2b8096a659919ca926f9c34ee5b87c062e9e36664ef22da",
    "application_image_id": "sha256:abde408ce71d54de3de4a211e358c0a3a6efb7c33267fa400ba32b0fe51b24e9",
    "calibration_source": "baseline training interval only",
    "config": {
      "calibration_quantile": 0.98,
      "consensus_rank": 3,
      "isolated_context_z_threshold": 8.0,
      "latent_dimension": 1,
      "lookback": 6,
      "maximum_detection_delay_windows": 6,
      "maximum_fault_rate_ratio": 0.2,
      "maximum_noise_alert_rate": 0.2,
      "maximum_validation_alert_rate": 0.2,
      "minimum_backlog_growth": 20.0,
      "minimum_noise_latency_ratio": 3.0,
      "ridge": 0.01,
      "threshold_safety_multiplier": 2.0
    },
    "detector_kind": "coherent_latent_predictive",
    "evaluator_config_sha256": "5cad46474cc84f4e18fafad4bd58609ed7ff3482a5b654105165a779c44190ea",
    "images": {
      "collector": "ghcr.io/open-telemetry/opentelemetry-collector-releases/opentelemetry-collector-contrib:0.153.0@sha256:93aad750175cbf1a973ae1c5886c3371f4d800f61be25cdd26870b8441ffe9fa",
      "postgres": "postgres@sha256:742f40ea20b9ff2ff31db5458d127452988a2164df9e17441e191f3b72252193",
      "python": "python@sha256:57cd7c3a7a273101a6485ba99423ee568157882804b1124b4dd04266317710de",
      "redis": "redis@sha256:e7723ff73d963f5cc6d9c4643ea3d989527a402a319239054e9472a7fb9219a2"
    },
    "logical_window_period_nano": 1000000000,
    "manifest_sha256": "cf30444443beaee38bb7f10c38609d38c67576a63048fea505749fe2a3dc2dae",
    "model_version": "b132ee80cf00ce51ab416ad5ef14dae4d907841528239658d7bfb689547bcb6d",
    "routine_noise_interval": [
      48,
      49
    ],
    "routine_noise_response_interval": [
      48,
      55
    ],
    "sample_period_seconds": 0.25,
    "structural_interval": [
      64,
      80
    ],
    "training_interval": [
      0,
      40
    ],
    "training_structural_points": 0
  },
  "raw_effects": {
    "baseline_db_write_rate_median": 24.0,
    "baseline_queue_depth_median": 0.0,
    "baseline_request_latency_ms_median": 0.675,
    "baseline_worker_rate_median": 24.0,
    "db_write_rate_fault_ratio": 0.0,
    "fault_db_write_rate_median": 0.0,
    "fault_queue_depth_max": 96.0,
    "fault_worker_rate_median": 0.0,
    "queue_depth_growth": 96.0,
    "routine_noise_latency_ratio": 46.325333333333326,
    "routine_noise_request_latency_ms_median": 31.269599999999997,
    "worker_rate_fault_ratio": 0.0
  },
  "schema_version": 1,
  "window_compiler_artifact": {
    "location": [
      24.0,
      0.675,
      0.0,
      0.0,
      24.0,
      0.0030679702758789062,
      24.0
    ],
    "lookback": 6,
    "scale": [
      2.9652,
      0.34337016000000004,
      1.0,
      1.0,
      2.9652,
      0.0032755167245864867,
      2.9652
    ],
    "schema_version": 1
  }
}
